{
  "schema_version": "1.0",
  "as_of": "2026-08-19",
  "provider": {
    "id": "xai",
    "name": "xAI (Grok)",
    "group": "saas",
    "homepage": "https://x.ai",
    "api_docs_url": "https://docs.x.ai/developers",
    "tokenizer_docs_url": null,
    "native_mcp_support": {
      "value": true,
      "confidence": "high",
      "source_url": "https://docs.x.ai/developers/tools/remote-mcp",
      "source_tier": 1,
      "as_of": "2026-08-19",
      "notes": "Remote MCP Tools remain natively supported and are documented against grok-4.6. Configure with {type:'mcp', server_url, server_label, server_description, allowed_tools, authorization, headers}; xAI holds the MCP connection server-side. Docs (re-read 2026-08-19): 'Only Streaming HTTP and SSE transports are supported' (no stdio). Works with 'the xAI native SDK, the OpenAI compatible Responses API, and the Speech to Speech API'. 'The require_approval and connector_id parameters in the OpenAI Responses API are not currently supported.' Pricing page: MCP invocations are token-billed only — 'you will not be charged for the tool invocation but will be charged for any tokens used.'"
    },
    "skills_concept": {
      "value": null,
      "confidence": "high",
      "source_url": "https://docs.x.ai/build/features/skills-plugins-marketplaces",
      "source_tier": 1,
      "as_of": "2026-08-19",
      "notes": "Still no API-level skills primitive. Grok Build (the CLI/TUI coding harness) documents skills as 'reusable folders containing markdown instructions, script files, and resources for agents', discovered from ./.grok/skills/ (walked to repo root), ~/.grok/skills/, enabled plugin directories and configured custom paths, with user-invocable skills exposed as /<skill-name> slash commands (progressive disclosure). These are CLI/product features, not developer-API primitives, and xAI publishes no token/context cost for them. Grok Bot (launched 2026-08-11, docs.x.ai/grok-bot/bots) is likewise a product-level 'durable AI teammate' surface, not an API skills mechanism."
    }
  },
  "models": [
    {
      "id": "grok-4.6",
      "display_name": "Grok 4.6",
      "family": "Grok 4",
      "release_date": {
        "value": "2026-08-12",
        "confidence": "high",
        "source_url": "https://docs.x.ai/developers/release-notes",
        "source_tier": 1,
        "as_of": "2026-08-19",
        "notes": "Release notes, August 12 2026: 'Grok 4.6, SpaceXAI's frontier model for coding, agentic tasks, and knowledge work, is now available on the xAI API.' Same entry states the 500k context window and the $2/$0.50/$6 short-context / $4/$1/$12 long-context pricing and the low/medium/high(default)/xhigh reasoning-effort ladder."
      },
      "status": "ga",
      "knowledge_cutoff": {
        "value": "2026-02-01",
        "confidence": "high",
        "source_url": "https://docs.x.ai/developers/models",
        "source_tier": 1,
        "as_of": "2026-08-19",
        "notes": "Models page states verbatim: 'The knowledge cut-off date of Grok 4.6 is February 1, 2026.' Recorded as the exact stated date."
      },
      "modalities": [
        "text",
        "image"
      ],
      "context": {
        "context_window_tokens": {
          "value": 500000,
          "unit": "tokens",
          "confidence": "high",
          "source_url": "https://docs.x.ai/developers/models/grok-4.6",
          "source_tier": 1,
          "as_of": "2026-08-19",
          "notes": "Model card: 'Context window: 500,000'. Pricing table also lists grok-4.6 at 500k. NOTE this is HALF of grok-4.3's 1M window — the flagship moved down in context while moving up in price, so an MCP tool surface occupies twice the share of the window it did on grok-4.3."
        },
        "input_output_shared": {
          "value": true,
          "confidence": "medium",
          "source_url": "https://docs.x.ai/developers/models/grok-4.6",
          "source_tier": 1,
          "as_of": "2026-08-19",
          "notes": "xAI does not state separate input/output pools; the OpenAI-compatible convention (one shared window) is implied and the model card publishes a single 'Context window' number. Medium confidence — not explicitly documented."
        },
        "max_input_tokens": {
          "value": null,
          "unit": "tokens",
          "confidence": "low",
          "source_url": "https://docs.x.ai/developers/models/grok-4.6",
          "source_tier": 1,
          "as_of": "2026-08-19",
          "derived": false,
          "notes": "No max-input cap is documented separately from the 500k window. Not derived, because no max-output figure is published to subtract."
        },
        "max_output_tokens_default": {
          "value": null,
          "unit": "tokens",
          "confidence": "low",
          "source_url": "https://docs.x.ai/developers/models/grok-4.6",
          "source_tier": 1,
          "as_of": "2026-08-19",
          "notes": "No default max-output value is published on the model card or in the API reference (checked 2026-08-19). max_tokens is accepted through the OpenAI-compatible surface but its default is not documented."
        },
        "max_output_tokens_max": {
          "value": null,
          "unit": "tokens",
          "confidence": "low",
          "source_url": "https://docs.x.ai/developers/models/grok-4.6",
          "source_tier": 1,
          "as_of": "2026-08-19",
          "notes": "No maximum single-completion cap is published. What binds is the 500k shared window; xAI documents no separate per-response numeric ceiling."
        },
        "extended_context": {
          "value": null,
          "unit": "tokens",
          "confidence": "high",
          "source_url": "https://docs.x.ai/developers/pricing",
          "source_tier": 1,
          "as_of": "2026-08-19",
          "notes": "No beta/extended window beyond 500k. The 200k figure that appears in pricing is a LONG-CONTEXT PRICING threshold, not a window: 'Models with long context pricing bill the long context rates for all tokens in a request once its prompt reaches the model's long context threshold' (grok-4.6: >= 200k)."
        },
        "reasoning_tokens_count_as_output": {
          "value": true,
          "confidence": "high",
          "source_url": "https://docs.x.ai/developers/advanced-api-usage/prompt-caching/usage-and-pricing",
          "source_tier": 1,
          "as_of": "2026-08-19",
          "notes": "'Reasoning tokens: Full completion token price' — reasoning tokens bill at the output rate and are reported via reasoning_tokens in usage. The reasoning docs add: 'reasoning_effort defaults to high. Reasoning cannot be disabled.'"
        }
      },
      "tokenization": {
        "tokenizer_family": {
          "value": "xai-grok",
          "confidence": "low",
          "source_url": "https://docs.x.ai/developers/api-reference",
          "source_tier": 1,
          "as_of": "2026-08-19",
          "notes": "xAI still publishes no tokenizer name, no HF tokenizer repo and no tiktoken base. The API reference (re-read 2026-08-19) documents Chat/Images/Videos/Voice/Models/Files/Batches endpoint families and no tokenizer or count-tokens endpoint. 'xai-grok' is a placeholder label, not a vendor-published family name."
        },
        "tokenizer_public": {
          "value": false,
          "confidence": "medium",
          "source_url": "https://docs.x.ai/developers/api-reference",
          "source_tier": 1,
          "as_of": "2026-08-19",
          "notes": "No public tokenizer library, HF repo or tiktoken base found as of 2026-08-19; no count-tokens endpoint in the API reference. Medium confidence: absence of documentation is not proof of absence."
        },
        "tokenizer_access": {
          "value": "closed",
          "confidence": "medium",
          "source_url": "https://docs.x.ai/developers/api-reference",
          "source_tier": 1,
          "as_of": "2026-08-19",
          "notes": "Closed for programmatic local use. The interactive Tokenizer Playground in the xAI console remains the only exploration path; no API and no library are documented."
        },
        "count_tokens_method": {
          "value": null,
          "confidence": "low",
          "source_url": "https://docs.x.ai/developers/api-reference",
          "source_tier": 1,
          "as_of": "2026-08-19",
          "notes": "No count-tokens API endpoint documented (unlike OpenAI's token-counting endpoint or Google countTokens). Searched docs.x.ai API reference and the web for an xAI count-tokens endpoint on 2026-08-19 and found none. Local estimation must fall back to the raw_json_rough profile."
        },
        "image_token_rule": {
          "value": null,
          "confidence": "low",
          "source_url": "https://docs.x.ai/developers/model-capabilities/images/understanding",
          "source_tier": 1,
          "as_of": "2026-08-19",
          "notes": "Image input is supported but xAI publishes no image-to-token conversion rule (no tile/patch formula like OpenAI's). The image-understanding page (re-read 2026-08-19) documents only 'Maximum image size: 20MiB', 'Supported image file types: jpg/jpeg or png', and states there is no documented per-request numeric cap on the number of images — what binds is the 20MiB per-image size limit and the model's context window. Image tokens are billed as input tokens."
        },
        "audio_token_rule": {
          "value": null,
          "confidence": "high",
          "source_url": "https://docs.x.ai/developers/models",
          "source_tier": 1,
          "as_of": "2026-08-19",
          "notes": "No audio input on the text models; speech is handled by the separate Voice / Speech-to-Speech API models. No audio token rule applies here."
        },
        "chars_per_token_estimate": {
          "value": null,
          "confidence": "low",
          "source_url": null,
          "as_of": "2026-08-19",